ID,N_VICTIMAS,FECHA,AAAA,MM,DD,HORA,HH,LUGAR_DEL_HECHO,TIPO_DE_CALLE,Calle,Dirección Normalizada,COMUNA,pos x,pos y,PARTICIPANTES,VICTIMA,ACUSADO,ID_hecho,ROL,SEXO,EDAD,FECHA_FALLECIMIENTO,AÑO,DIA_SEMANA,Categoria_Participante,FALLECIMIENTO_MISMO_DIA
2017-0068,1,2017-05-27,2017,5,27,19:50:00,19,AV. TTE. FRANCISCO RABANAL 2950,AVENIDA,"RABANAL, FRANCISCO, INTENDENTE AV.","RABANAL, FRANCISCO, INTENDENTE AV. 2950",8,-58.43580656,-34.66437532,MOTO-OBJETO FIJO,MOTO,OBJETO FIJO,2017-0068,CONDUCTOR,MASCULINO,32,2017-05-27,2017,Saturday,MOTO,1
2017-0069,1,2017-05-24,2017,5,24,14:15:00,14,AV. GRAL. PAZ Y ULRICO SCHMIDL,GRAL PAZ,"PAZ, GRAL. AV.","PAZ, GRAL. AV. y SCHMIDL, ULRICO",9,-58.52173071,-34.65997463,MOTO-SD,MOTO,PASAJEROS,2017-0069,CONDUCTOR,MASCULINO,39,2017-05-29,2017,Wednesday,MOTO,0
2017-0070,1,2017-05-30,2017,5,30,13:20:00,13,NUEVA YORK  3696,CALLE,NUEVA YORK,NUEVA YORK 3696,11,-58.50791763,-34.59804273,PEATON-AUTO,PEATON,AUTO,2017-0070,PEATON,MASCULINO,80,2017-05-31,2017,Tuesday,PEATON,0
2017-0072,1,2017-06-03,2017,6,3,23:20:00,23,AV. DE LOS CONSTITUYENTES Y VALLEJOS,AVENIDA,DE LOS CONSTITUYENTES AV.,DE LOS CONSTITUYENTES AV. y VALLEJOS,12,-58.49175088,-34.58226957,AUTO-AUTO,AUTO,AUTO,2017-0072,CONDUCTOR,MASCULINO,25,2017-06-03,2017,Saturday,AUTO,1
2017-0073,1,2017-06-04,2017,6,4,09:00:00,9,AV. CORRIENTES Y ECUADOR,AVENIDA,CORRIENTES AV.,CORRIENTES AV. y ECUADOR,3,-58.40781467,-34.60425669,MOTO-AUTO,MOTO,AUTO,2017-0073,CONDUCTOR,MASCULINO,19,2017-06-04,2017,Sunday,MOTO,1
2017-0074,1,2017-06-04,2017,6,4,12:50:00,12,CASCO 133,CALLE,CASCO,CASCO 133,9,-58.52567073,-34.63787791,SD-SD,AUTO,AUTO,2017-0074,SD,MASCULINO,70,2017-06-04,2017,Sunday,SD,1
2017-0075,1,2017-06-12,2017,6,12,22:38:00,22,AV. DE MAYO Y AV. 9 DE JULIO,AVENIDA,DE MAYO AV.,DE MAYO AV. y 9 DE JULIO AV.,1,-58.381542,-34.60906385,PEATON-MOTO,PEATON,MOTO,2017-0075,PEATON,MASCULINO,55,2017-06-12,2017,Monday,PEATON,1
2017-0076,1,2017-06-13,2017,6,13,14:50:00,14,AV. RAMON CASTILLO Y CALLE 12,AVENIDA,"CASTILLO, RAMON S., PRES. AV.","CASTILLO, RAMON S., PRES. AV. y CALLE 12 (NO OFICIAL)",2,-58.38526125,-34.5780581,PEATON-CARGAS,PEATON,CARGAS,2017-0076,PEATON,FEMENINO,30,2017-06-13,2017,Tuesday,PEATON,1
2017-0077,1,2017-06-17,2017,6,17,23:45:00,23,FRAY JUSTO SANTAMARIA DE ORO 1930,CALLE,FRAY JUSTO SANTAMARIA DE ORO,FRAY JUSTO SANTAMARIA DE ORO 1930,14,-58.42934104,-34.58451712,MOTO-CARGAS,MOTO,CARGAS,2017-0077,CONDUCTOR,FEMENINO,60,2017-06-18,2017,Saturday,MOTO,0
2017-0079,1,2017-06-19,2017,6,19,16:26:00,16,MEXICO Y DEAN FUNES,CALLE,MEXICO,MEXICO y DEAN FUNES,3,-58.40657493,-34.61781124,MOTO-CARGAS,MOTO,CARGAS,2017-0079,CONDUCTOR,MASCULINO,33,2017-06-19,2017,Monday,MOTO,1
2017-0080,1,2017-06-22,2017,6,22,10:15:00,10,AV. JUAN B ALBERDI Y AV. ESCALADA,AVENIDA,"ALBERDI, JUAN BAUTISTA AV.","ALBERDI, JUAN BAUTISTA AV. y ESCALADA AV.",9,-58.49525314,-34.64487785,PEATON-CARGAS,PEATON,CARGAS,2017-0080,PEATON,FEMENINO,95,2017-06-22,2017,Thursday,PEATON,1
2017-0082,1,2017-06-25,2017,6,25,22:40:00,22,AV. ENTRE RIOS Y AV. BRASIL,AVENIDA,ENTRE RIOS AV.,ENTRE RIOS AV. y BRASIL,4,-58.39092851,-34.62932696,PEATON-AUTO,PEATON,AUTO,2017-0082,PEATON,MASCULINO,36,2017-06-25,2017,Sunday,PEATON,1
2017-0083,1,2017-07-04,2017,7,4,00:25:00,0,AV. JUAN B ALBERDI Y GUARDIA NACIONAL,AVENIDA,"ALBERDI, JUAN BAUTISTA AV.","ALBERDI, JUAN BAUTISTA AV. y GUARDIA NACIONAL",9,-58.49603546,-34.64564271,MOTO-CARGAS,MOTO,CARGAS,2017-0083,CONDUCTOR,MASCULINO,37,2017-07-04,2017,Tuesday,MOTO,1
2017-0084,1,2017-07-05,2017,7,5,12:49:00,12,AV. DEL LIBERTADOR Y RODRIGUEZ PEÑA,AVENIDA,DEL LIBERTADOR AV.,DEL LIBERTADOR AV. y RODRIGUEZ PEÃ‘A,2,-58.38502878,-34.58703485,PEATON-PASAJEROS,PEATON,PASAJEROS,2017-0084,PEATON,FEMENINO,73,2017-07-05,2017,Wednesday,PEATON,1
2017-0085,1,2017-07-07,2017,7,7,14:15:00,14,TACUARI Y AV. MARTIN GARCIA,AVENIDA,TACUARI,"TACUARI y GARCIA, MARTIN AV.",4,-58.37261143,-34.63150425,PEATON-PASAJEROS,PEATON,PASAJEROS,2017-0085,PEATON,MASCULINO,84,2017-07-07,2017,Friday,PEATON,1
2017-0086,1,2017-07-09,2017,7,9,07:30:00,7,AV. RIVADAVIA Y MURGUIONDO,AVENIDA,RIVADAVIA AV.,RIVADAVIA AV. y MURGUIONDO,9,-58.51876802,-34.63905965,PEATON-MOTO,PEATON,MOTO,2017-0086,PEATON,FEMENINO,30,2017-07-09,2017,Sunday,PEATON,1
2017-0087,1,2017-07-10,2017,7,10,10:45:00,10,24 DE NOVIEMBRE 390,CALLE,24 DE NOVIEMBRE,24 DE NOVIEMBRE 390,3,-58.41095567,-34.61516101,PEATON-AUTO,PEATON,AUTO,2017-0087,PEATON,FEMENINO,73,2017-07-10,2017,Monday,PEATON,1
2017-0088,1,2017-07-10,2017,7,10,22:30:00,22,AV. PASEO COLON Y BRASIL,AVENIDA,PASEO COLON AV.,PASEO COLON AV. y BRASIL AV.,1,-58.36797542,-34.62519403,PEATON-PASAJEROS,PEATON,PASAJEROS,2017-0088,PEATON,MASCULINO,43,2017-07-10,2017,Monday,PEATON,1
2017-0089,1,2017-07-13,2017,7,13,12:05:00,12,MARTINIANO LEGUIZAMON 901,CALLE,"LEGUIZAMON, MARTINIANO","LEGUIZAMON, MARTINIANO 901",9,-58.51514709,-34.64787051,SD-AUTO,MOTO,AUTO,2017-0089,SD,MASCULINO,23,2017-07-13,2017,Thursday,SD,1
2017-0090,1,2017-07-15,2017,7,15,05:15:00,5,AV. CHIVILCOY Y COLECTORA AV. GRAL. PAZ ,GRAL PAZ,CHIVILCOY AV.,"CHIVILCOY AV. y PAZ, GRAL. AV.",11,-58.51925642,-34.59171721,PEATON-AUTO,PEATON,AUTO,2017-0090,PEATON,MASCULINO,22,2017-07-15,2017,Saturday,PEATON,1
2017-0091,1,2017-07-15,2017,7,15,13:00:00,13,SUPERI Y AV. GRAL. PAZ,GRAL PAZ,SUPERI,"SUPERI y PAZ, GRAL. AV.",12,-58.48671535,-34.54321216,MOTO-SD,MOTO,PASAJEROS,2017-0091,CONDUCTOR,MASCULINO,58,2017-07-15,2017,Saturday,MOTO,1
2017-0092,1,2017-07-24,2017,7,24,22:16:01,22,AU 25 DE MAYO Y AU FRONDIZI (9 DE JULIO SUR),AUTOPISTA,AUTOPISTA 25 DE MAYO,AUTOPISTA 25 DE MAYO y AUTOPISTA 1 SUR PRESIDENTE ARTURO FRONDIZI,1,-58.38268809,-34.62282019,PEATON-AUTO,PEATON,AUTO,2017-0092,PEATON,MASCULINO,66,2017-07-24,2017,Monday,PEATON,1
2017-0093,1,2017-07-25,2017,7,25,16:48:40,16,"AV. LEOPOLDO LUGONES KM 7,5, ALTURA PUENTE SCALABRINI ORTIZ, SENTIDO A CENTRO PORTEÑO",AUTOPISTA,"LUGONES, LEOPOLDO AV.","LUGONES, LEOPOLDO AV. y PUENTE DISTRIBUIDOR SCALABRINI ORTIZ",13,-58.43633522,-34.54966288,PEATON-AUTO,PEATON,AUTO,2017-0093,PEATON,MASCULINO,42,2017-07-25,2017,Tuesday,PEATON,1
2017-0094,1,2017-07-27,2017,7,27,08:50:00,8,VICTOR HUGO 2639,CALLE,"HUGO, VICTOR","HUGO, VICTOR 2639",10,-58.52640838,-34.61765855,BICICLETA-CARGAS,BICICLETA,CARGAS,2017-0094,CICLISTA,FEMENINO,56,2017-07-27,2017,Thursday,BICICLETA,1
2017-0095,1,2017-08-06,2017,8,6,08:00:00,8,AV. CORDOBA Y JERONIMO SALGUERO,AVENIDA,CORDOBA AV.,"CORDOBA AV. y SALGUERO, JERONIMO",14,-58.41894306,-34.59778875,MOTO-AUTO,MOTO,AUTO,2017-0095,CONDUCTOR,MASCULINO,36,2017-08-06,2017,Sunday,MOTO,1
2017-0096,1,2017-08-07,2017,8,7,19:50:00,19,AV. CABILDO Y NUÑEZ,AVENIDA,CABILDO AV.,CABILDO AV. y NUÃ‘EZ,13,-58.46756026,-34.54972741,PEATON-PASAJEROS,PEATON,PASAJEROS,2017-0096,PEATON,MASCULINO,87,2017-08-07,2017,Monday,PEATON,1
2017-0098,1,2017-08-08,2017,8,8,12:10:00,12,JOSE BONIFACIO 2114,CALLE,"BONIFACIO, JOSE","BONIFACIO, JOSE 2114",7,-58.45715752,-34.63132912,PEATON-AUTO,PEATON,AUTO,2017-0098,PEATON,FEMENINO,61,2017-08-08,2017,Tuesday,PEATON,1
2017-0099,1,2017-08-17,2017,8,17,19:45:00,19,AV. PTE FIGUEROA ALCORTA 5400,AVENIDA,"FIGUEROA ALCORTA, PRES. AV.","FIGUEROA ALCORTA, PRES. AV. 5400",14,-58.42406784,-34.56213916,BICICLETA-AUTO,BICICLETA,AUTO,2017-0099,CICLISTA,MASCULINO,28,2017-08-17,2017,Thursday,BICICLETA,1
2017-0100,1,2017-08-21,2017,8,21,07:45:00,7,VENEZUELA 2135,CALLE,REPUBLICA BOLIVARIANA DE VENEZUELA,REPUBLICA BOLIVARIANA DE VENEZUELA 2135,3,-58.3967447,-34.61512051,MOTO-OBJETO FIJO,MOTO,OBJETO FIJO,2017-0100,PASAJERO_ACOMPAÑANTE,FEMENINO,16,2017-08-21,2017,Monday,MOTO,1
2017-0101,1,2017-08-23,2017,8,23,10:00:00,10,AV. FCO. LACROZE Y ZAPATA,AVENIDA,"LACROZE, FEDERICO AV.","LACROZE, FEDERICO AV. y ZAPATA",13,-58.44537508,-34.57084818,MULTIPLE,PEATON,MULTIPLE,2017-0101,PEATON,FEMENINO,61,2017-08-23,2017,Wednesday,MULTIPLE,1
2017-0102,1,2017-08-24,2017,8,24,01:10:00,1,IRIARTE Y ZAVALETA,AVENIDA,"IRIARTE, GRAL. AV.","IRIARTE, GRAL. AV. y ZAVALETA",4,-58.40056767,-34.6510708,PEATON-CARGAS,PEATON,CARGAS,2017-0102,PEATON,MASCULINO,46,2017-08-24,2017,Thursday,PEATON,1
2017-0104,1,2017-08-25,2017,8,25,09:00:00,9,AV. 9 DE JULIO Y ESTADOS UNIDOS,AVENIDA,9 DE JULIO AV.,9 DE JULIO AV. y ESTADOS UNIDOS,1,-58.38109568,-34.61853244,PEATON-CARGAS,PEATON,CARGAS,2017-0104,PEATON,FEMENINO,18,2017-08-25,2017,Friday,PEATON,1
2017-0106,1,2017-08-31,2017,8,31,19:50:00,19,FRAY JUSTO SANTAMARIA DE ORO Y GUEMES,CALLE,FRAY JUSTO SANTAMARIA DE ORO,FRAY JUSTO SANTAMARIA DE ORO y GUEMES,14,-58.42533612,-34.58035258,PEATON-PASAJEROS,PEATON,PASAJEROS,2017-0106,PEATON,FEMENINO,85,2017-08-31,2017,Thursday,PEATON,1
2017-0107,1,2017-09-01,2017,9,1,11:30:00,11,AV. DEL LIBERTADOR Y JARAMILLO,AVENIDA,DEL LIBERTADOR AV.,DEL LIBERTADOR AV. y JARAMILLO,13,-58.46062311,-34.54395182,MOTO-CARGAS,MOTO,CARGAS,2017-0107,CONDUCTOR,MASCULINO,41,2017-09-01,2017,Friday,MOTO,1
2017-0108,2,2017-09-02,2017,9,2,04:53:08,4,AV. GRAL. PAZ Y MACHAIN,GRAL PAZ,"PAZ, GRAL. AV.","PAZ, GRAL. AV. y MACHAIN",12,-58.49491054,-34.54795581,AUTO-OBJETO FIJO,OBJETO FIJO,AUTO,2017-0108,PASAJERO_ACOMPAÑANTE,MASCULINO,17,2017-09-02,2017,Saturday,AUTO,1
2017-0108,2,2017-09-02,2017,9,2,04:53:08,4,AV. GRAL. PAZ Y MACHAIN,GRAL PAZ,"PAZ, GRAL. AV.","PAZ, GRAL. AV. y MACHAIN",12,-58.49491054,-34.54795581,AUTO-OBJETO FIJO,OBJETO FIJO,AUTO,2017-0108,PASAJERO_ACOMPAÑANTE,MASCULINO,10,2017-09-02,2017,Saturday,AUTO,1
2017-0109,1,2017-09-04,2017,9,4,21:00:00,21,AV. DIRECTORIO Y PORTELA,AVENIDA,DIRECTORIO AV.,DIRECTORIO AV. y PORTELA,7,-58.47130269,-34.63665402,MOTO-AUTO,MOTO,AUTO,2017-0109,CONDUCTOR,MASCULINO,21,2017-09-05,2017,Monday,MOTO,0
2017-0110,1,2017-09-06,2017,9,6,14:15:00,14,LAVALLE Y AV. LEANDRO N ALEM,AVENIDA,LAVALLE,"LAVALLE y ALEM, LEANDRO N. AV.",1,-58.370488,-34.60189492,PEATON-PASAJEROS,PEATON,PASAJEROS,2017-0110,PEATON,MASCULINO,56,2017-09-07,2017,Wednesday,PEATON,0
2017-0111,1,2017-09-07,2017,9,7,18:23:37,18,USPALLATA Y PIROVANO,CALLE,USPALLATA,USPALLATA y PIROVANO,4,-58.42023854,-34.6423411,PEATON-CARGAS,PEATON,CARGAS,2017-0111,PEATON,FEMENINO,79,2017-09-07,2017,Thursday,PEATON,1
2017-0112,2,2017-09-10,2017,9,10,09:32:17,9,AU 25 DE MAYO Y AV. VARELA,AUTOPISTA,AUTOPISTA 25 DE MAYO,AUTOPISTA 25 DE MAYO y VARELA AV.,7,-58.45807401,-34.6399743,AUTO-OBJETO FIJO,AUTO,OBJETO FIJO,2017-0112,PASAJERO_ACOMPAÑANTE,MASCULINO,1,2017-09-10,2017,Sunday,AUTO,1
2017-0112,2,2017-09-10,2017,9,10,09:32:17,9,AU 25 DE MAYO Y AV. VARELA,AUTOPISTA,AUTOPISTA 25 DE MAYO,AUTOPISTA 25 DE MAYO y VARELA AV.,7,-58.45807401,-34.6399743,AUTO-OBJETO FIJO,AUTO,OBJETO FIJO,2017-0112,PASAJERO_ACOMPAÑANTE,MASCULINO,42,2017-09-13,2017,Sunday,AUTO,0
2017-0113,1,2017-09-11,2017,9,11,06:30:00,6,AV. SANTA FE Y MAIPU,AVENIDA,SANTA FE AV.,SANTA FE AV. y MAIPU,1,-58.37697717,-34.59573848,PEATON-PASAJEROS,PEATON,PASAJEROS,2017-0113,PEATON,FEMENINO,76,2017-09-11,2017,Monday,PEATON,1
2017-0114,1,2017-09-15,2017,9,15,02:30:00,2,AV. ALVEAR Y AV. DEL LIBERTADOR,AVENIDA,ALVEAR AV.,ALVEAR AV. y DEL LIBERTADOR AV.,2,-58.3910058,-34.5849866,AUTO-OBJETO FIJO,AUTO,OBJETO FIJO,2017-0114,CONDUCTOR,MASCULINO,26,2017-09-15,2017,Friday,AUTO,1
2017-0115,1,2017-09-19,2017,9,19,18:52:33,18,AV. PAVON Y TREINTA Y TRES ORIENTALES,AVENIDA,PAVON AV.,PAVON AV. y TREINTA Y TRES ORIENTALES,5,-58.42182126,-34.63089661,MOTO-BICICLETA,MOTO,BICICLETA,2017-0115,CONDUCTOR,MASCULINO,34,2017-09-19,2017,Tuesday,MOTO,1
2017-0116,1,2017-09-20,2017,9,20,22:24:00,22,COLECTORA AV. GRAL. PAZ 5750,GRAL PAZ,"PAZ, GRAL. AV.","PAZ, GRAL. AV. 5750",12,-58.51389422,-34.58075791,MOTO-OBJETO FIJO,MOTO,OBJETO FIJO,2017-0116,CONDUCTOR,MASCULINO,22,2017-09-20,2017,Wednesday,MOTO,1
2017-0118,1,2017-09-22,2017,9,22,07:02:09,7,VIEYTES Y CRUZ,AVENIDA,VIEYTES,"VIEYTES y CRUZ, OSVALDO AV.",4,-58.37585415,-34.65232158,MOTO-AUTO,MOTO,AUTO,2017-0118,PASAJERO_ACOMPAÑANTE,FEMENINO,26,2017-09-29,2017,Friday,MOTO,0
2017-0120,1,2017-10-02,2017,10,2,15:55:33,15,AU DELLEPIANE Y AV. ESCALADA,AUTOPISTA,AUTOPISTA DELLEPIANE LUIS TTE. GRAL.,AUTOPISTA DELLEPIANE LUIS TTE. GRAL. y ESCALADA AV.,9,-58.47297505,-34.66245085,MOTO-CARGAS,MOTO,CARGAS,2017-0120,CONDUCTOR,MASCULINO,20,2017-10-02,2017,Monday,MOTO,1
2017-0123,1,2017-10-10,2017,10,10,01:05:38,1,ALBARIÑO Y AV. ARGENTINA,AVENIDA,ALBARI?O,ALBARIÃ‘O y ARGENTINA AV.,8,-58.46855503,-34.67216349,PEATON-AUTO,PEATON,AUTO,2017-0123,PEATON,FEMENINO,36,2017-10-10,2017,Tuesday,PEATON,1
2017-0124,1,2017-10-12,2017,10,12,14:40:28,14,JUAN RAMIREZ DE VELAZCO 1211,CALLE,"RAMIREZ DE VELASCO, JUAN","RAMIREZ DE VELASCO, JUAN 1211",15,-58.44254033,-34.59185043,MOTO-PASAJEROS,MOTO,PASAJEROS,2017-0124,CONDUCTOR,MASCULINO,51,2017-10-12,2017,Thursday,MOTO,1
2017-0125,1,2017-10-13,2017,10,13,06:12:20,6,AV. FERNANDEZ DE LA CRUZ Y LARRAYA,AVENIDA,"FERNANDEZ DE LA CRUZ, F., GRAL. AV.","FERNANDEZ DE LA CRUZ, F., GRAL. AV. y LARRAYA",8,-58.46622247,-34.67926929,MOTO-OBJETO FIJO,MOTO,OBJETO FIJO,2017-0125,CONDUCTOR,MASCULINO,29,2017-10-13,2017,Friday,MOTO,1
2017-0126,2,2017-10-14,2017,10,14,06:15:00,6,AV. RIESTRA Y CAÑADA DE GOMEZ,AVENIDA,RIESTRA AV.,RIESTRA AV. y CAÃ‘ADA DE GOMEZ,8,-58.48003734,-34.68148508,AUTO-OBJETO FIJO,AUTO,OBJETO FIJO,2017-0126,PASAJERO_ACOMPAÑANTE,MASCULINO,39,2017-10-14,2017,Saturday,AUTO,1
2017-0126,2,2017-10-14,2017,10,14,06:15:00,6,AV. RIESTRA Y CAÑADA DE GOMEZ,AVENIDA,RIESTRA AV.,RIESTRA AV. y CAÃ‘ADA DE GOMEZ,8,-58.48003734,-34.68148508,AUTO-OBJETO FIJO,AUTO,OBJETO FIJO,2017-0126,CONDUCTOR,MASCULINO,36,2017-10-14,2017,Saturday,AUTO,1
2017-0127,1,2017-10-16,2017,10,16,07:45:00,7,GALLO Y AV. CORDOBA,AVENIDA,GALLO,GALLO y CORDOBA AV.,2,-58.41192137,-34.59800248,MOTO-MOTO,MOTO,MOTO,2017-0127,PASAJERO_ACOMPAÑANTE,MASCULINO,24,2017-10-16,2017,Monday,MOTO,1
2017-0128,1,2017-10-17,2017,10,17,12:30:00,12,DR. JUAN F. ARANGUREN 611,CALLE,"ARANGUREN, JUAN F., DR.","ARANGUREN, JUAN F., DR. 611",6,-58.44034689,-34.61349731,PEATON-PASAJEROS,PEATON,PASAJEROS,2017-0128,PEATON,FEMENINO,60,2017-10-17,2017,Tuesday,PEATON,1
2017-0129,1,2017-10-26,2017,10,26,19:15:15,19,AU PERITO MORENO Y AU 25 DE MAYO,AUTOPISTA,AUTOPISTA PERITO MORENO,AUTOPISTA PERITO MORENO y AUTOPISTA 25 DE MAYO,9,-58.47155277,-34.64925746,MOTO-PASAJEROS,MOTO,PASAJEROS,2017-0129,CONDUCTOR,MASCULINO,57,2017-10-26,2017,Thursday,MOTO,1
2017-0130,1,2017-10-27,2017,10,27,05:30:00,5,CHORROARIN Y AV. SAN MARTIN,AVENIDA,CHORROARIN,CHORROARIN y SAN MARTIN AV.,15,-58.47883099,-34.59967065,AUTO-CARGAS,AUTO,CARGAS,2017-0130,CONDUCTOR,MASCULINO,23,2017-10-27,2017,Friday,AUTO,1
2017-0132,1,2017-10-30,2017,10,30,14:00:00,14,COSQUIN Y AV. CNEL. ROCA,AVENIDA,COSQUIN,"COSQUIN y ROCA, CNEL. AV.",8,-58.46552171,-34.6937413,MOTO-PASAJEROS,MOTO,PASAJEROS,2017-0132,CONDUCTOR,MASCULINO,23,2017-10-30,2017,Monday,MOTO,1
2017-0134,1,2017-11-06,2017,11,6,18:00:00,18,AV. CNEL. ROCA 3555,AVENIDA,"ROCA, CNEL. AV.","ROCA, CNEL. AV. 3555",8,-58.4423972,-34.66777987,PEATON-PASAJEROS,PEATON,PASAJEROS,2017-0134,PEATON,FEMENINO,47,2017-11-06,2017,Monday,PEATON,1
2017-0135,1,2017-11-07,2017,11,7,12:14:10,12,AV. WARNES Y PUNTA ARENAS,AVENIDA,WARNES AV.,WARNES AV. y PUNTA ARENAS,15,-58.47032551,-34.59626814,MOTO-CARGAS,MOTO,CARGAS,2017-0135,CONDUCTOR,MASCULINO,24,2017-11-07,2017,Tuesday,MOTO,1
2017-0136,1,2017-11-16,2017,11,16,08:43:00,8,DEL BARCO CENTENERA Y RABANAL,AVENIDA,BARCO CENTENERA DEL,"BARCO CENTENERA DEL y RABANAL, FRANCISCO, INTENDENTE AV.",4,-58.41827843,-34.65522746,PEATON-PASAJEROS,PEATON,PASAJEROS,2017-0136,PEATON,MASCULINO,55,2017-11-16,2017,Thursday,PEATON,1
2017-0137,1,2017-11-17,2017,11,17,11:45:00,11,AV. GRAL. ENRIQUE MOSCONI Y SAN NICOLAS,AVENIDA,MOSCONI GENERAL AV.,MOSCONI GENERAL AV. y SAN NICOLAS,11,-58.51280715,-34.59279388,PEATON-CARGAS,PEATON,CARGAS,2017-0137,PEATON,FEMENINO,60,2017-11-17,2017,Friday,PEATON,1
2017-0138,1,2017-11-19,2017,11,19,10:30:00,10,AV. LAFUENTE Y AV. EVA PERON,AVENIDA,LAFUENTE AV.,"LAFUENTE AV. y PERON, EVA AV.",7,-58.46258582,-34.64385704,MOTO-OBJETO FIJO,MOTO,OBJETO FIJO,2017-0138,PASAJERO_ACOMPAÑANTE,MASCULINO,25,2017-11-19,2017,Sunday,MOTO,1
2017-0139,1,2017-11-19,2017,11,19,22:30:00,22,AV. CNEL. ROCA Y AV. ESCALADA,AVENIDA,"ROCA, CNEL. AV.","ROCA, CNEL. AV. y ESCALADA AV.",8,-58.45064148,-34.68003614,AUTO-OBJETO FIJO,AUTO,OBJETO FIJO,2017-0139,PASAJERO_ACOMPAÑANTE,FEMENINO,15,2017-11-19,2017,Sunday,AUTO,1
2017-0140,1,2017-11-19,2017,11,19,23:22:17,23,AU ARTURO FRONDIZI PKM 3100,AUTOPISTA,AUTOPISTA 1 SUR PRESIDENTE ARTURO FRONDIZI,AUTOPISTA 1 SUR PRESIDENTE ARTURO FRONDIZI,4,,,MOTO-PASAJEROS,MOTO,PASAJEROS,2017-0140,CONDUCTOR,MASCULINO,24,2017-11-19,2017,Sunday,MOTO,1
2017-0141,1,2017-11-23,2017,11,23,19:45:00,19,AV. LA PLATA Y AV. PEDRO GOYENA,AVENIDA,LA PLATA AV.,"LA PLATA AV. y GOYENA, PEDRO AV.",6,-58.42717783,-34.62513374,PEATON-PASAJEROS,PEATON,PASAJEROS,2017-0141,PEATON,FEMENINO,22,2017-11-23,2017,Thursday,PEATON,1
2017-0143,1,2017-11-25,2017,11,25,21:45:00,21,TRELLES Y GRAL. CESAR DIAZ,CALLE,"TRELLES, MANUEL R.","TRELLES, MANUEL R. y DIAZ, CESAR, GRAL.",11,-58.46442001,-34.60724519,AUTO-PASAJEROS,AUTO,PASAJEROS,2017-0143,CONDUCTOR,MASCULINO,50,2017-11-25,2017,Saturday,AUTO,1
2017-0144,1,2017-11-26,2017,11,26,06:45:00,6,AV. CNEL. ROCA Y COLECTORA AV. GRAL. PAZ,GRAL PAZ,"ROCA, CNEL. AV.","ROCA, CNEL. AV. y PAZ, GRAL. AV.",8,-58.47064556,-34.69843756,AUTO-OBJETO FIJO,AUTO,OBJETO FIJO,2017-0144,PASAJERO_ACOMPAÑANTE,FEMENINO,50,2017-11-26,2017,Sunday,AUTO,1
2017-0145,1,2017-11-26,2017,11,26,17:05:00,17,MAZA Y DON BOSCO,CALLE,MAZA,MAZA y DON BOSCO,5,-58.41677733,-34.61223119,MOTO-AUTO,MOTO,AUTO,2017-0145,CONDUCTOR,MASCULINO,58,2017-11-26,2017,Sunday,MOTO,1
2017-0147,1,2017-11-28,2017,11,28,11:15:00,11,AV. GRAL. PAZ Y AV. EVA PERON,GRAL PAZ,"PAZ, GRAL. AV.","PAZ, GRAL. AV. y PERON, EVA AV.",9,-58.5025179,-34.67450313,MOTO-AUTO,MOTO,AUTO,2017-0147,CONDUCTOR,MASCULINO,49,2017-11-28,2017,Tuesday,MOTO,1
2017-0148,1,2017-11-29,2017,11,29,10:45:00,10,AV. SAN JUAN Y LA RIOJA,AVENIDA,SAN JUAN AV.,SAN JUAN AV. y LA RIOJA,3,-58.40708125,-34.62438894,PEATON-PASAJEROS,PEATON,PASAJEROS,2017-0148,PEATON,FEMENINO,82,2017-11-29,2017,Wednesday,PEATON,1
2017-0149,1,2017-11-30,2017,11,30,12:20:00,12,AV. PASEO COLON Y MEXICO,AVENIDA,PASEO COLON AV.,PASEO COLON AV. y MEXICO,1,-58.36947198,-34.61477051,PEATON-PASAJEROS,PEATON,PASAJEROS,2017-0149,PEATON,MASCULINO,13,2017-11-30,2017,Thursday,PEATON,1
2017-0150,1,2017-12-04,2017,12,4,01:15:00,1,AV. RIVADAVIA Y MIRALLA,AVENIDA,RIVADAVIA AV.,RIVADAVIA AV. y MIRALLA,9,-58.51140889,-34.63934531,PEATON-AUTO,PEATON,AUTO,2017-0150,PEATON,MASCULINO,56,2017-12-04,2017,Monday,PEATON,1
2017-0151,1,2017-12-04,2017,12,4,02:15:00,2,VIEYTES Y LUJAN,CALLE,VIEYTES,VIEYTES y LUJAN,4,-58.37460912,-34.65559133,PEATON-PASAJEROS,PEATON,PASAJEROS,2017-0151,PEATON,MASCULINO,42,2017-12-04,2017,Monday,PEATON,1
2017-0152,1,2017-12-06,2017,12,6,17:30:00,17,CACHI Y TRAFUL,CALLE,CACHI,CACHI y TRAFUL,4,-58.41146277,-34.65073916,BICICLETA-PASAJEROS,BICICLETA,PASAJEROS,2017-0152,CICLISTA,MASCULINO,19,2017-12-06,2017,Wednesday,BICICLETA,1
2017-0153,2,2017-12-11,2017,12,11,02:00:00,2,ROSARIO Y AV. LA PLATA,AVENIDA,ROSARIO,ROSARIO y LA PLATA AV.,6,-58.42855267,-34.61829385,MOTO-PASAJEROS,MOTO,PASAJEROS,2017-0153,PASAJERO_ACOMPAÑANTE,MASCULINO,42,2017-12-12,2017,Monday,MOTO,0
2017-0153,2,2017-12-11,2017,12,11,02:00:00,2,ROSARIO Y AV. LA PLATA,AVENIDA,ROSARIO,ROSARIO y LA PLATA AV.,6,-58.42855267,-34.61829385,MOTO-PASAJEROS,MOTO,PASAJEROS,2017-0153,CONDUCTOR,MASCULINO,30,2017-12-12,2017,Monday,MOTO,0
2017-0154,1,2017-12-11,2017,12,11,09:15:00,9,AV. ENTRE RIOS Y AV. CASEROS ,AVENIDA,ENTRE RIOS AV.,ENTRE RIOS AV. y CASEROS AV.,4,-58.39035581,-34.63412287,PEATON-PASAJEROS,PEATON,PASAJEROS,2017-0154,PEATON,MASCULINO,76,2017-12-11,2017,Monday,PEATON,1
2017-0155,1,2017-12-12,2017,12,12,21:25:41,21,AV. RIVADAVIA 6350,AVENIDA,RIVADAVIA AV.,RIVADAVIA AV. 6350,7,-58.45593915,-34.62656868,SD-MOTO,MOTO,MOTO,2017-0155,SD,MASCULINO,77,2017-12-12,2017,Tuesday,SD,1
2017-0157,1,2017-12-17,2017,12,17,09:02:00,9,AV. GRAL. PAZ Y HUMAITA,GRAL PAZ,"PAZ, GRAL. AV.","PAZ, GRAL. AV. y HUMAITA",9,-58.52866211,-34.64597065,AUTO-PASAJEROS,AUTO,PASAJEROS,2017-0157,CONDUCTOR,MASCULINO,53,2017-12-17,2017,Sunday,AUTO,1
2017-0158,1,2017-12-18,2017,12,18,21:30:00,21,GUALEGUAYCHU Y COLECTORA AV. GRAL PAZ,GRAL PAZ,GUALEGUAYCHU,"GUALEGUAYCHU y PAZ, GRAL. AV.",11,-58.52037476,-34.59407024,MOTO-AUTO,MOTO,AUTO,2017-0158,CONDUCTOR,MASCULINO,32,2017-12-18,2017,Monday,MOTO,1
2017-0159,1,2017-12-20,2017,12,20,04:31:27,4,AV. INDEPENDENCIA Y VIRREY CEVALLOS,AVENIDA,INDEPENDENCIA AV.,"INDEPENDENCIA AV. y CEVALLOS, VIRREY",1,-58.38896772,-34.61799615,MOTO-AUTO,MOTO,AUTO,2017-0159,CONDUCTOR,MASCULINO,27,2017-12-20,2017,Wednesday,MOTO,1
2017-0160,1,2017-12-22,2017,12,22,13:15:00,13,AV. NAZCA 365,AVENIDA,NAZCA AV.,NAZCA AV. 365,7,-58.47074114,-34.62771756,PEATON-MOTO,PEATON,MOTO,2017-0160,PEATON,FEMENINO,30,2017-12-22,2017,Friday,PEATON,1
2017-0161,1,2017-12-26,2017,12,26,15:30:00,15,AV. EVA PERON 5249,AVENIDA,"PERON, EVA AV.","PERON, EVA AV. 5249",9,-58.48200819,-34.65969965,PEATON-AUTO,PEATON,AUTO,2017-0161,PEATON,FEMENINO,30,2017-12-26,2017,Tuesday,PEATON,1
2018-0001,1,2018-01-01,2018,1,1,22:50:00,22,San Juan Av. Y Rincón,AVENIDA,SAN JUAN AV.,SAN JUAN AV. y RINCON,3,-58.39536773,-34.62297346,PEATON-MOTO,PEATON,MOTO,2018-0001,PEATON,MASCULINO,83,2018-01-02,2018,Monday,PEATON,0
2018-0002,1,2018-01-03,2018,1,3,16:40:00,16,Peru 937,CALLE,PERU,PERU 937,1,-58.37456088,-34.61895467,BICICLETA-PASAJEROS,BICICLETA,PASAJEROS,2018-0002,CICLISTA,FEMENINO,26,2018-01-03,2018,Wednesday,BICICLETA,1
2018-0003,1,2018-01-05,2018,1,5,10:12:00,10,"Pueyrredon, Honorio, Dr. Av. y Galicia",AVENIDA,"PUEYRREDON, HONORIO, DR. AV.","PUEYRREDON, HONORIO, DR. AV. y GALICIA",15,-58.44860217,-34.60395657,MULTIPLE,PEATON,MULTIPLE,2018-0003,PEATON,FEMENINO,58,2018-01-05,2018,Friday,MULTIPLE,1
2018-0004,1,2018-01-09,2018,1,9,09:40:00,9,Del Libertador Av. y Manzanares,AVENIDA,DEL LIBERTADOR AV.,DEL LIBERTADOR AV. y MANZANARES,13,-58.46129513,-34.54332766,MULTIPLE,MOTO,MULTIPLE,2018-0004,CONDUCTOR,MASCULINO,39,2018-01-09,2018,Tuesday,MULTIPLE,1
2018-0005,1,2018-01-09,2018,1,9,22:30:00,22,Paseo Colon Av. 1019,AVENIDA,PASEO COLON AV.,PASEO COLON AV. 1019,1,-58.36907201,-34.61953517,PEATON-PASAJEROS,PEATON,PASAJEROS,2018-0005,PEATON,MASCULINO,54,2018-01-09,2018,Tuesday,PEATON,1
2018-0006,1,2018-01-10,2018,1,10,21:15:00,21,Valle y Barco Centenera Del,CALLE,VALLE,VALLE y BARCO CENTENERA DEL,6,-58.44062219,-34.62499107,BICICLETA-PASAJEROS,BICICLETA,PASAJEROS,2018-0006,CICLISTA,FEMENINO,45,2018-01-10,2018,Wednesday,BICICLETA,1
2018-0007,1,2018-01-11,2018,1,11,02:30:00,2,AU Perito Moreno  KM 0.6,AUTOPISTA,AUTOPISTA PERITO MORENO,AUTOPISTA PERITO MORENO KM. 0.6,9,-58.52502765,-34.63601265,AUTO-AUTO,AUTO,AUTO,2018-0007,CONDUCTOR,MASCULINO,46,2018-01-11,2018,Thursday,AUTO,1
2018-0008,1,2018-01-12,2018,1,12,17:50:00,17,"Huergo, Ing. Av. e Independencia Av.",AVENIDA,"HUERGO, ING. AV.","HUERGO, ING. AV. e INDEPENDENCIA AV.",1,-58.36659655,-34.61687778,MOTO-CARGAS,MOTO,CARGAS,2018-0008,CONDUCTOR,FEMENINO,32,2018-01-12,2018,Friday,MOTO,1
2018-0009,1,2018-01-14,2018,1,14,02:00:00,2,"Pilcomayo y Brown, Alte. Av.",AVENIDA,PILCOMAYO,"PILCOMAYO y BROWN, ALTE. AV.",4,-58.36737389,-34.62763661,MOTO-MOTO,MOTO,MOTO,2018-0009,CONDUCTOR,MASCULINO,19,2018-01-14,2018,Sunday,MOTO,1
2018-0010,1,2018-01-18,2018,1,18,05:10:00,5,"Cervantes y Belaustegui, Luis, Dr.",CALLE,CERVANTES,"CERVANTES y BELAUSTEGUI, LUIS, DR.",10,-58.49807953,-34.63038658,MOTO-CARGAS,MOTO,CARGAS,2018-0010,CONDUCTOR,MASCULINO,40,2018-01-18,2018,Thursday,MOTO,1
2018-0011,1,2018-01-19,2018,1,19,10:30:00,10,Callao y Vte. Lopez,AVENIDA,CALLAO AV.,"CALLAO AV. y LOPEZ, VICENTE",2,-58.39092703,-34.59088447,PEATON-PASAJEROS,PEATON,PASAJEROS,2018-0011,PEATON,MASCULINO,84,2018-01-19,2018,Friday,PEATON,1
2018-0012,1,2018-01-26,2018,1,26,13:30:00,13,"Oliden y Chilavert, Martiniano, Coronel",CALLE,OLIDEN,"OLIDEN y CHILAVERT, MARTINIANO, CORONEL",8,-58.46912006,-34.68049201,MOTO-PASAJEROS,MOTO,PASAJEROS,2018-0012,CONDUCTOR,MASCULINO,20,2018-01-26,2018,Friday,MOTO,1
2018-0013,1,2018-01-28,2018,1,28,08:15:00,8,Congreso Av. y Galvan,AVENIDA,CONGRESO AV.,CONGRESO AV. y GALVAN,12,-58.48661286,-34.56786129,MOTO-AUTO,MOTO,AUTO,2018-0013,CONDUCTOR,MASCULINO,44,2018-01-28,2018,Sunday,MOTO,1
2018-0014,1,2018-01-31,2018,1,31,20:00:00,20,"Moreno, Perito Av. y Rivera Indarte",AVENIDA,"MORENO, PERITO AV.","MORENO, PERITO AV. y RIVERA INDARTE AV.",7,-58.44074927,-34.65080597,PEATON-MOTO,PEATON,MOTO,2018-0014,PEATON,MASCULINO,42,2018-02-04,2018,Wednesday,PEATON,0
2018-0015,2,2018-02-06,2018,2,6,01:00:00,1,Australia Av. 2800,AVENIDA,AUSTRALIA AV.,AUSTRALIA AV. 2800,4,-58.38636298,-34.64684275,MOTO-PASAJEROS,MOTO,PASAJEROS,2018-0015,CONDUCTOR,MASCULINO,28,2018-02-06,2018,Tuesday,MOTO,1
2018-0015,2,2018-02-06,2018,2,6,01:00:00,1,Australia Av. 2800,AVENIDA,AUSTRALIA AV.,AUSTRALIA AV. 2800,4,-58.38636298,-34.64684275,MOTO-PASAJEROS,MOTO,PASAJEROS,2018-0015,PASAJERO_ACOMPAÑANTE,MASCULINO,19,2018-02-06,2018,Tuesday,MOTO,1
2018-0016,1,2018-02-15,2018,2,15,10:15:00,10,"Del Libertador Av. y Ramos Mejia, Jose Maria, Dr. Av.",AVENIDA,DEL LIBERTADOR AV.,"DEL LIBERTADOR AV. y RAMOS MEJIA, JOSE MARIA, DR. AV.",1,-58.37533517,-34.59276462,MOTO-CARGAS,MOTO,CARGAS,2018-0016,CONDUCTOR,MASCULINO,31,2018-02-15,2018,Thursday,MOTO,1
2018-0017,1,2018-02-17,2018,2,17,04:15:00,4,San Pedrito Av. y Rivadavia Av.,AVENIDA,SAN PEDRITO AV.,SAN PEDRITO AV. y RIVADAVIA AV.,7,-58.46963952,-34.63070603,PEATON-AUTO,PEATON,AUTO,2018-0017,PEATON,MASCULINO,35,2018-02-20,2018,Saturday,PEATON,0
2018-0018,1,2018-02-17,2018,2,17,07:15:00,7,"Isabel La Catolica y Salvadores, Cnel.",CALLE,ISABEL LA CATOLICA,"ISABEL LA CATOLICA y SALVADORES, CNEL.",4,-58.37207554,-34.64543658,MOTO-CARGAS,MOTO,CARGAS,2018-0018,CONDUCTOR,MASCULINO,26,2018-02-17,2018,Saturday,MOTO,1
2018-0019,1,2018-02-17,2018,2,17,12:30:00,12,Las Heras General Av. y Callao Av.,AVENIDA,LAS HERAS GENERAL AV.,LAS HERAS GENERAL AV. y CALLAO AV.,2,-58.39189441,-34.59176378,PEATON-PASAJEROS,PEATON,PASAJEROS,2018-0019,PEATON,FEMENINO,80,2018-02-17,2018,Saturday,PEATON,1
