ID,N_VICTIMAS,FECHA,AAAA,MM,DD,HORA,HH,LUGAR_DEL_HECHO,TIPO_DE_CALLE,Calle,Dirección Normalizada,COMUNA,pos x,pos y,PARTICIPANTES,VICTIMA,ACUSADO,ID_hecho,ROL,SEXO,EDAD,FECHA_FALLECIMIENTO,AÑO,DIA_SEMANA,Categoria_Participante,FALLECIMIENTO_MISMO_DIA
2016-0001,1,2016-01-01,2016,1,1,04:00:00,4,AV PIEDRA BUENA Y AV FERNANDEZ DE LA CRUZ,AVENIDA,PIEDRA BUENA AV.,"PIEDRA BUENA AV. y FERNANDEZ DE LA CRUZ, F., GRAL. AV.",8,-58.47533969,-34.68757022,MOTO-AUTO,MOTO,AUTO,2016-0001,CONDUCTOR,MASCULINO,19,2016-01-01,2016,Friday,MOTO,1
2016-0002,1,2016-01-02,2016,1,2,01:15:00,1,AV GRAL PAZ  Y AV DE LOS CORRALES,GRAL PAZ,"PAZ, GRAL. AV.","PAZ, GRAL. AV. y DE LOS CORRALES AV.",9,-58.50877521,-34.66977709,AUTO-PASAJEROS,AUTO,PASAJEROS,2016-0002,CONDUCTOR,MASCULINO,70,2016-01-02,2016,Saturday,AUTO,1
2016-0003,1,2016-01-03,2016,1,3,07:00:00,7,AV ENTRE RIOS 2034,AVENIDA,ENTRE RIOS AV.,ENTRE RIOS AV. 2034,1,-58.39040293,-34.63189362,MOTO-AUTO,MOTO,AUTO,2016-0003,CONDUCTOR,MASCULINO,30,2016-01-03,2016,Sunday,MOTO,1
2016-0004,1,2016-01-10,2016,1,10,00:00:00,0,AV LARRAZABAL Y GRAL VILLEGAS CONRADO,AVENIDA,LARRAZABAL AV.,"LARRAZABAL AV. y VILLEGAS, CONRADO, GRAL.",8,-58.46503904,-34.68092974,MOTO-SD,MOTO,CARGAS,2016-0004,CONDUCTOR,MASCULINO,18,2016-01-10,2016,Sunday,MOTO,1
2016-0005,1,2016-01-21,2016,1,21,05:20:00,5,AV SAN JUAN Y PRESIDENTE LUIS SAENZ PEÑA ,AVENIDA,SAN JUAN AV.,"SAN JUAN AV. y SAENZ PEÃ‘A, LUIS, PRES.",1,-58.38718297,-34.6224663,MOTO-PASAJEROS,MOTO,PASAJEROS,2016-0005,CONDUCTOR,MASCULINO,29,2016-02-01,2016,Thursday,MOTO,0
2016-0008,1,2016-01-24,2016,1,24,18:30:00,18,AV 27 DE FEBRERO Y AV ESCALADA,AVENIDA,27 DE FEBRERO AV.,27 DE FEBRERO AV. y ESCALADA AV.,8,-58.44451316,-34.68475866,MOTO-OBJETO FIJO,MOTO,OBJETO FIJO,2016-0008,CONDUCTOR,MASCULINO,30,2016-01-24,2016,Sunday,MOTO,1
2016-0009,1,2016-01-24,2016,1,24,19:10:00,19,NOGOYA Y JOAQUIN V. GONZALES,CALLE,NOGOYA,"NOGOYA y GONZALEZ, JOAQUIN V.",11,-58.50095869,-34.6082544,MOTO-AUTO,MOTO,AUTO,2016-0009,PASAJERO_ACOMPAÑANTE,MASCULINO,29,2016-01-26,2016,Sunday,MOTO,0
2016-0010,1,2016-01-29,2016,1,29,15:20:00,15,AV GENERAL PAZ Y AV DE LOS CORRALES,GRAL PAZ,"PAZ, GRAL. AV.","PAZ, GRAL. AV. y DE LOS CORRALES AV.",9,-58.50877521,-34.66977709,MOTO-AUTO,MOTO,AUTO,2016-0010,CONDUCTOR,MASCULINO,18,2016-01-29,2016,Friday,MOTO,1
2016-0012,1,2016-02-08,2016,2,8,01:20:00,1,AV BELGRANO Y BERNARDO DE IRIGOYEN,AVENIDA,BELGRANO AV.,"BELGRANO AV. e IRIGOYEN, BERNARDO DE",1,-58.38048577,-34.61303893,MOTO-CARGAS,MOTO,CARGAS,2016-0012,CONDUCTOR,MASCULINO,22,2016-02-08,2016,Monday,MOTO,1
2016-0013,1,2016-02-10,2016,2,10,11:30:00,11,AV ENTRE RIOS 1366,AVENIDA,ENTRE RIOS AV.,ENTRE RIOS AV. 1366,1,-58.39114932,-34.62477387,PEATON-AUTO,PEATON,AUTO,2016-0013,PEATON,MASCULINO,16,2016-02-10,2016,Wednesday,PEATON,1
2016-0015,1,2016-02-14,2016,2,14,05:14:00,5,AV SCALABRINI ORTIZ Y VERA,AVENIDA,"SCALABRINI ORTIZ, RAUL AV.","SCALABRINI ORTIZ, RAUL AV. y VERA",15,-58.4376002,-34.59912758,PEATON-AUTO,PEATON,AUTO,2016-0015,PEATON,FEMENINO,16,2016-02-14,2016,Sunday,PEATON,1
2016-0016,1,2016-02-14,2016,2,14,22:00:00,22,AV REGIMIENTO DE PATRICIOS Y QUINQUELA MARTIN BENITO,AVENIDA,REGIMIENTO DE PATRICIOS AV.,"REGIMIENTO DE PATRICIOS AV. y QUINQUELA MARTIN, BENITO",4,-58.36882665,-34.64291993,MOTO-AUTO,MOTO,AUTO,2016-0016,PASAJERO_ACOMPAÑANTE,FEMENINO,19,2016-02-14,2016,Sunday,MOTO,1
2016-0017,1,2016-02-15,2016,2,15,16:54:00,16,MARIANO ACOSTA Y ANA MARIA JANER,AVENIDA,"ACOSTA, MARIANO","ACOSTA, MARIANO y JANER, ANA MARIA",8,-58.44989671,-34.65970435,PEATON-MOTO,PEATON,MOTO,2016-0017,PEATON,MASCULINO,59,2016-02-16,2016,Monday,PEATON,0
2016-0019,1,2016-02-17,2016,2,17,09:30:00,9,LISANDRO DE LA TORRE Y SEVERO GARCIA GRANDE DE ZEQUEIRA ,CALLE,"DE LA TORRE, LISANDRO","DE LA TORRE, LISANDRO y GARCIA GRANDE DE ZEQUEIRA, SEVERO",9,-58.50990884,-34.65468721,PEATON-PASAJEROS,PEATON,PASAJEROS,2016-0019,PEATON,FEMENINO,65,2016-02-17,2016,Wednesday,PEATON,1
2016-0020,1,2016-02-17,2016,2,17,16:00:00,16,SUIPACHA 156,CALLE,SUIPACHA,SUIPACHA 156,1,-58.37952223,-34.60653282,PEATON-AUTO,PEATON,AUTO,2016-0020,PEATON,MASCULINO,59,2016-03-02,2016,Wednesday,PEATON,0
2016-0021,1,2016-02-17,2016,2,17,23:35:00,23,AV DIRECTORIO Y CURAPALIGUE,AVENIDA,DIRECTORIO AV.,DIRECTORIO AV. y CURAPALIGUE,7,-58.45157703,-34.63063795,AUTO-AUTO,AUTO,AUTO,2016-0021,CONDUCTOR,MASCULINO,34,2016-02-17,2016,Wednesday,AUTO,1
2016-0022,1,2016-02-21,2016,2,21,06:00:00,6,AV 9 DE JULIO Y ADOLFO ALSINA,AVENIDA,9 DE JULIO AV.,"9 DE JULIO AV. y ALSINA, ADOLFO",1,-58.38144696,-34.61079875,MOTO-AUTO,MOTO,AUTO,2016-0022,PASAJERO_ACOMPAÑANTE,MASCULINO,41,2016-02-21,2016,Sunday,MOTO,1
2016-0025,1,2016-02-28,2016,2,28,04:50:00,4,AV GRAL PAZ Y AV 27 DE FEBRERO,GRAL PAZ,"PAZ, GRAL. AV.","PAZ, GRAL. AV. y 27 DE FEBRERO AV.",8,-58.46244952,-34.70524971,AUTO-AUTO,AUTO,AUTO,2016-0025,PASAJERO_ACOMPAÑANTE,MASCULINO,34,2016-02-28,2016,Sunday,AUTO,1
2016-0026,1,2016-02-28,2016,2,28,07:30:00,7,HOLMBERG Y VEDIA,CALLE,HOLMBERG,HOLMBERG y VEDIA,12,-58.49216191,-34.54738649,AUTO-OBJETO FIJO,AUTO,OBJETO FIJO,2016-0026,CONDUCTOR,MASCULINO,30,2016-03-04,2016,Sunday,AUTO,0
2016-0027,1,2016-02-28,2016,2,28,09:35:00,9,CURAPALIGUE Y AVELINO DIAZ,AVENIDA,CURAPALIGUE AV.,"CURAPALIGUE AV. y DIAZ, AVELINO",7,-58.44497874,-34.63852623,AUTO-AUTO,AUTO,AUTO,2016-0027,PASAJERO_ACOMPAÑANTE,MASCULINO,34,2016-02-28,2016,Sunday,AUTO,1
2016-0028,1,2016-03-02,2016,3,2,10:00:00,10,VIAMONTE Y AV 9 DE JULIO,AVENIDA,VIAMONTE,VIAMONTE y 9 DE JULIO AV.,1,-58.38199706,-34.60028648,PEATON-CARGAS,PEATON,CARGAS,2016-0028,PEATON,MASCULINO,50,2016-03-02,2016,Wednesday,PEATON,1
2016-0029,1,2016-03-04,2016,3,4,17:30:00,17,AV CABILDO Y DEHEZA,AVENIDA,CABILDO AV.,CABILDO AV. y DEHEZA,12,-58.47378664,-34.54153077,PEATON-PASAJEROS,PEATON,PASAJEROS,2016-0029,PEATON,MASCULINO,38,2016-03-04,2016,Friday,PEATON,1
2016-0031,1,2016-03-08,2016,3,8,12:30:00,12,AV GRAL PAZ Y AV CNEL ROCA,GRAL PAZ,"PAZ, GRAL. AV.","PAZ, GRAL. AV. y ROCA, CNEL. AV.",8,-58.47064556,-34.69843756,MOTO-PASAJEROS,MOTO,PASAJEROS,2016-0031,CONDUCTOR,MASCULINO,21,2016-03-08,2016,Tuesday,MOTO,1
2016-0034,1,2016-03-12,2016,3,12,12:30:00,12,AV AMANCIO ALCORTA Y BONAVENA,AVENIDA,"ALCORTA, AMANCIO AV.","ALCORTA, AMANCIO AV. y BONAVENA, OSCAR NATALIO",4,-58.40623949,-34.65076549,PEATON-PASAJEROS,PEATON,PASAJEROS,2016-0034,PEATON,MASCULINO,52,2016-03-12,2016,Saturday,PEATON,1
2016-0035,1,2016-03-13,2016,3,13,06:00:00,6,AV CORRIENTES Y AV CALLAO,AVENIDA,CORRIENTES AV.,CORRIENTES AV. y CALLAO AV.,3,-58.39228965,-34.60443527,MOTO-PASAJEROS,MOTO,PASAJEROS,2016-0035,CONDUCTOR,MASCULINO,34,2016-03-13,2016,Sunday,MOTO,1
2016-0036,1,2016-03-14,2016,3,14,00:15:00,0,HERRERA Y ARISTOBULO DEL VALLE,CALLE,HERRERA,"HERRERA y VALLE, ARISTOBULO DEL",4,-58.37813396,-34.63668504,MOTO-PASAJEROS,MOTO,PASAJEROS,2016-0036,PASAJERO_ACOMPAÑANTE,MASCULINO,36,2016-03-14,2016,Monday,MOTO,1
2016-0037,1,2016-03-19,2016,3,19,11:00:00,11,AV. EVA PERON Y QUIRNO,AVENIDA,LAFUENTE AV.,LAFUENTE AV. y QUIRNO,7,-58.46275892,-34.64358293,MOTO-MOTO,MOTO,MOTO,2016-0037,CONDUCTOR,MASCULINO,20,2016-03-19,2016,Saturday,MOTO,1
2016-0038,1,2016-03-21,2016,3,21,08:06:00,8,AV GRAL PAZ COLECTORA Y ZUVIRIA,GRAL PAZ,"PAZ, GRAL. AV.","PAZ, GRAL. AV. y ZUVIRIA",8,-58.49683458,-34.67892743,PEATON-PASAJEROS,PEATON,PASAJEROS,2016-0038,PEATON,MASCULINO,29,2016-03-21,2016,Monday,PEATON,1
2016-0039,1,2016-03-23,2016,3,23,01:50:00,1,BARTOLOME MITRE Y AV PUEYRREDON,AVENIDA,"MITRE, BARTOLOME","MITRE, BARTOLOME y PUEYRREDON AV.",3,-58.40603217,-34.6088396,MOTO-PASAJEROS,MOTO,PASAJEROS,2016-0039,CONDUCTOR,MASCULINO,20,2016-03-23,2016,Wednesday,MOTO,1
2016-0041,2,2016-03-29,2016,3,29,11:00:00,11,AV DIRECTORIO Y RIVERA INDARTE,AVENIDA,DIRECTORIO AV.,DIRECTORIO AV. y RIVERA INDARTE AV.,7,-58.4607655,-34.63350444,MOTO-CARGAS,MOTO,CARGAS,2016-0041,CONDUCTOR,MASCULINO,54,2016-03-29,2016,Tuesday,MOTO,1
2016-0041,2,2016-03-29,2016,3,29,11:00:00,11,AV DIRECTORIO Y RIVERA INDARTE,AVENIDA,DIRECTORIO AV.,DIRECTORIO AV. y RIVERA INDARTE AV.,7,-58.4607655,-34.63350444,MOTO-CARGAS,MOTO,CARGAS,2016-0041,PASAJERO_ACOMPAÑANTE,MASCULINO,42,2016-03-30,2016,Tuesday,MOTO,0
2016-0043,1,2016-03-30,2016,3,30,18:15:00,18,DELLEPIANE LUIS TTE GRAL COLECTORA Y MURGUIONDO,AVENIDA,"DELLEPIANE, LUIS, TTE. GRAL.","DELLEPIANE, LUIS, TTE. GRAL. y MURGUIONDO",8,-58.47832463,-34.67494416,PEATON-CARGAS,PEATON,CARGAS,2016-0043,PEATON,FEMENINO,56,2016-03-30,2016,Wednesday,PEATON,1
2016-0044,1,2016-03-31,2016,3,31,19:40:00,19,AV JOSE MARIA MORENO Y BALBASTRO,AVENIDA,"MORENO, JOSE MARIA AV.","MORENO, JOSE MARIA AV. y BALBASTRO",7,-58.43213235,-34.63693953,MULTIPLE,MOTO,MULTIPLE,2016-0044,CONDUCTOR,MASCULINO,24,2016-03-31,2016,Thursday,MULTIPLE,1
2016-0045,1,2016-04-11,2016,4,11,10:25:00,10,AV GRAL PAZ Y AV DEL LIBERTADOR,GRAL PAZ,"PAZ, GRAL. AV.","PAZ, GRAL. AV. y DEL LIBERTADOR AV.",13,-58.46743471,-34.53476874,MOTO-SD,MOTO,AUTO,2016-0045,CONDUCTOR,MASCULINO,42,2016-04-11,2016,Monday,MOTO,1
2016-0047,1,2016-04-15,2016,4,15,05:30:00,5,LIMA 1483,CALLE,LIMA,LIMA 1483,1,-58.38247061,-34.62571878,PEATON-PASAJEROS,PEATON,PASAJEROS,2016-0047,PEATON,MASCULINO,41,2016-04-15,2016,Friday,PEATON,1
2016-0048,1,2016-04-15,2016,4,15,17:40:00,17,AV. CORRIENTES Y AV. DORREGO,AVENIDA,CORRIENTES AV.,CORRIENTES AV. y DORREGO AV.,15,-58.44759966,-34.5917024,PEATON-PASAJEROS,PEATON,PASAJEROS,2016-0048,PEATON,FEMENINO,42,2016-04-15,2016,Friday,PEATON,1
2016-0049,1,2016-04-17,2016,4,17,00:00:00,0,"AUTOPISTA 1 SUR PRESIDENTE ARTURO FRONDIZI KM. 0,700",AUTOPISTA,AUTOPISTA 1 SUR PRESIDENTE ARTURO FRONDIZI,AUTOPISTA 1 SUR PRESIDENTE ARTURO FRONDIZI,4,-58.37714647568196,-34.63657525428238,SD-SD,MOTO,CARGAS,2016-0049,SD,MASCULINO,42,2016-04-17,2016,Sunday,SD,1
2016-0050,1,2016-04-19,2016,4,19,09:50:00,9,TIMOTEO GORDILLO Y AV FERNANDEZ DE LA CRUZ,AVENIDA,"GORDILLO, TIMOTEO","GORDILLO, TIMOTEO y FERNANDEZ DE LA CRUZ, F., GRAL. AV.",8,-58.47305463,-34.68550712,PEATON-PASAJEROS,PEATON,PASAJEROS,2016-0050,PEATON,MASCULINO,78,2016-04-19,2016,Tuesday,PEATON,1
2016-0051,1,2016-04-20,2016,4,20,04:00:00,4,AV AMANCIO ALCORTA Y BONAVENA,AVENIDA,"ALCORTA, AMANCIO AV.","ALCORTA, AMANCIO AV. y BONAVENA, OSCAR NATALIO",4,-58.40623949,-34.65076549,MOTO-CARGAS,MOTO,CARGAS,2016-0051,CONDUCTOR,MASCULINO,36,2016-04-20,2016,Wednesday,MOTO,1
2016-0052,1,2016-04-20,2016,4,20,20:00:00,20,AUTOPISTA LUGONES PK 10000,AUTOPISTA,"LUGONES, LEOPOLDO AV.",SD,13,,,MOTO-SD,MOTO,CARGAS,2016-0052,SD,FEMENINO,42,2016-04-20,2016,Wednesday,MOTO,1
2016-0053,1,2016-04-22,2016,4,22,09:30:00,9,AV TRIUNVIRATO Y AV OLAZABAL,AVENIDA,TRIUNVIRATO AV.,TRIUNVIRATO AV. y OLAZABAL AV.,12,-58.4842918,-34.57558053,PEATON-PASAJEROS,PEATON,PASAJEROS,2016-0053,PEATON,MASCULINO,38,2016-04-22,2016,Friday,PEATON,1
2016-0054,1,2016-04-23,2016,4,23,21:00:00,21,AU LUIS DELLEPIANE Y AV GRAL PAZ,AUTOPISTA,AUTOPISTA DELLEPIANE LUIS TTE. GRAL.,"AUTOPISTA DELLEPIANE LUIS TTE. GRAL. y PAZ, GRAL. AV.",8,-58.48695354,-34.68795245,MOTO-MOTO,MOTO,MOTO,2016-0054,CONDUCTOR,MASCULINO,30,2016-04-25,2016,Saturday,MOTO,0
2016-0055,1,2016-04-25,2016,4,25,20:30:00,20,RAMON CASTILLA Y AV FIGUEROA ALCORTA,AVENIDA,"CASTILLA, RAMON, MARISCAL","CASTILLA, RAMON, MARISCAL y FIGUEROA ALCORTA, PRES. AV.",14,-58.40021959,-34.57964781,PEATON-CARGAS,PEATON,CARGAS,2016-0055,PEATON,MASCULINO,79,2016-04-28,2016,Monday,PEATON,0
2016-0056,1,2016-04-26,2016,4,26,04:45:00,4,AV LUIS MARIA CAMPOS 30,AVENIDA,"CAMPOS, LUIS M. AV.","CAMPOS, LUIS M. AV. 30",14,-58.42957885,-34.57660058,MOTO-OBJETO FIJO,MOTO,OBJETO FIJO,2016-0056,CONDUCTOR,MASCULINO,26,2016-04-26,2016,Tuesday,MOTO,1
2016-0058,1,2016-05-04,2016,5,4,14:00:00,14,LIMA 1471,CALLE,LIMA,LIMA 1471,1,-58.38247542,-34.62556293,PEATON-MOTO,PEATON,MOTO,2016-0058,PEATON,FEMENINO,57,2016-05-08,2016,Wednesday,PEATON,0
2016-0059,1,2016-05-08,2016,5,8,16:30:00,16,PASAJE CIUDADELA Y LIMA OESTE,CALLE,CIUDADELA,CIUDADELA y LIMA,1,-58.38222219,-34.62728101,PEATON-PASAJEROS,PEATON,PASAJEROS,2016-0059,PEATON,MASCULINO,37,2016-05-26,2016,Sunday,PEATON,0
2016-0064,1,2016-05-14,2016,5,14,18:11:00,18,AV JUAN B JUSTO Y AV CARRASCO,AVENIDA,"JUSTO, JUAN B. AV.","JUSTO, JUAN B. AV. y CARRASCO AV.",10,-58.49485242,-34.62953445,PEATON-PASAJEROS,PEATON,PASAJEROS,2016-0064,PEATON,MASCULINO,20,2016-05-14,2016,Saturday,PEATON,1
2016-0065,1,2016-05-20,2016,5,20,14:40:00,14,AV GAONA Y ESPINOSA,AVENIDA,GAONA AV.,GAONA AV. y ESPINOSA,6,-58.45227946,-34.61068024,PEATON-AUTO,PEATON,AUTO,2016-0065,PEATON,MASCULINO,20,2016-05-20,2016,Friday,PEATON,1
2016-0067,1,2016-05-21,2016,5,21,17:00:00,17,AV LISANDRO DE LA TORRE Y SARAZA,AVENIDA,"DE LA TORRE, LISANDRO","DE LA TORRE, LISANDRO y SARAZA",8,-58.48455411,-34.6751276,MOTO-PASAJEROS,MOTO,PASAJEROS,2016-0067,PASAJERO_ACOMPAÑANTE,FEMENINO,30,2016-05-21,2016,Saturday,MOTO,1
2016-0068,1,2016-05-22,2016,5,22,22:00:00,22,AV FIGUEROA ALCORTA Y AV PUEYRREDON,AVENIDA,"FIGUEROA ALCORTA, PRES. AV.","FIGUEROA ALCORTA, PRES. AV. y PUEYRREDON AV.",2,-58.39056593,-34.58418569,MOTO-PASAJEROS,MOTO,PASAJEROS,2016-0068,CONDUCTOR,MASCULINO,58,2016-05-22,2016,Sunday,MOTO,1
2016-0069,1,2016-05-23,2016,5,23,03:30:00,3,AV ENTRE RIOS Y PASAJE FILIBERTO,AVENIDA,ENTRE RIOS AV.,ENTRE RIOS AV. y FILIBERTO,3,-58.39118948,-34.62704273,AUTO-CARGAS,AUTO,CARGAS,2016-0069,CONDUCTOR,MASCULINO,30,2016-05-23,2016,Monday,AUTO,1
2016-0073,1,2016-06-11,2016,6,11,15:00:00,15,MAGARIÑOS CERVANTES 3900,CALLE,"MAGARI?OS CERVANTES, A.","MAGARIÃ‘OS CERVANTES, A. 3900",10,-58.49021952,-34.62025108,MOTO-CARGAS,MOTO,CARGAS,2016-0073,CONDUCTOR,MASCULINO,23,2016-06-11,2016,Saturday,MOTO,1
2016-0074,1,2016-06-12,2016,6,12,06:40:00,6,AV GRAL PAZ Y RODOLFO SCAPINO,GRAL PAZ,"PAZ, GRAL. AV.","PAZ, GRAL. AV. y SCAPINO, RODOLFO",8,-58.49896559,-34.67732118,AUTO-AUTO,AUTO,AUTO,2016-0074,CONDUCTOR,MASCULINO,60,2016-06-12,2016,Sunday,AUTO,1
2016-0075,1,2016-06-12,2016,6,12,23:13:00,23,AUTOPISTA DELLEPIANE LUIS TTE GRAL Y MIRALLA,AUTOPISTA,AUTOPISTA DELLEPIANE LUIS TTE. GRAL.,AUTOPISTA DELLEPIANE LUIS TTE. GRAL. y MIRALLA,8,-58.47461076,-34.66874679,PEATON-AUTO,PEATON,AUTO,2016-0075,PEATON,MASCULINO,42,2016-06-12,2016,Sunday,PEATON,1
2016-0076,1,2016-06-13,2016,6,13,16:20:00,16,AV SAN MARTIN Y CAMARONES,AVENIDA,SAN MARTIN AV.,SAN MARTIN AV. y CAMARONES,15,-58.46210891,-34.60356211,PEATON-PASAJEROS,PEATON,PASAJEROS,2016-0076,PEATON,FEMENINO,53,2016-06-13,2016,Monday,PEATON,1
2016-0077,1,2016-06-13,2016,6,13,21:52:00,21,TTEG JUAN D PERON Y AVDA LEANDRO N ALEM,AVENIDA,"PERON, JUAN DOMINGO, TTE. GENERAL","PERON, JUAN DOMINGO, TTE. GENERAL y ALEM, LEANDRO N. AV.",1,-58.3702777,-34.60536123,PEATON-PASAJEROS,PEATON,PASAJEROS,2016-0077,PEATON,FEMENINO,42,2016-06-13,2016,Monday,PEATON,1
2016-0078,1,2016-06-13,2016,6,13,23:01:00,23,AV BELGRANO Y AV JUJUY,AVENIDA,BELGRANO AV.,BELGRANO AV. y JUJUY AV.,3,-58.40491455,-34.6146383,MOTO-MOTO,MOTO,MOTO,2016-0078,CONDUCTOR,MASCULINO,30,2016-06-13,2016,Monday,MOTO,1
2016-0079,1,2016-06-16,2016,6,16,17:13:00,17,AV DEL LIBERTADOR Y AV GUILLERMO UDAONDO,AVENIDA,DEL LIBERTADOR AV.,"DEL LIBERTADOR AV. y UDAONDO, GUILLERMO AV.",13,-58.45504154,-34.54864492,AUTO-AUTO,AUTO,AUTO,2016-0079,CONDUCTOR,FEMENINO,51,2016-06-16,2016,Thursday,AUTO,1
2016-0080,1,2016-06-18,2016,6,18,06:42:00,6,AV GRAL PAZ Y AV RIVADAVIA,GRAL PAZ,"PAZ, GRAL. AV.","PAZ, GRAL. AV. y RIVADAVIA AV.",9,-58.52927982,-34.63931752,AUTO-SD,AUTO,PASAJEROS,2016-0080,CONDUCTOR,MASCULINO,60,2016-06-18,2016,Saturday,AUTO,1
2016-0081,1,2016-06-22,2016,6,22,07:42:00,7,AV CRISOLOGO LARRALDE Y MACHAIN,AVENIDA,"LARRALDE, CRISOLOGO AV.","LARRALDE, CRISOLOGO AV. y MACHAIN",12,-58.4872106,-34.55904606,MOTO-AUTO,MOTO,AUTO,2016-0081,CONDUCTOR,MASCULINO,40,2016-06-22,2016,Wednesday,MOTO,1
2016-0082,1,2016-06-27,2016,6,27,18:24:00,18,AV LA PLATA 2384,AVENIDA,LA PLATA AV.,LA PLATA AV. 2384,4,-58.42273092,-34.64228803,PEATON-AUTO,PEATON,AUTO,2016-0082,PEATON,MASCULINO,87,2016-07-05,2016,Monday,PEATON,0
2016-0083,1,2016-06-28,2016,6,28,20:46:00,20,AV JUAN B ALBERDI Y PUAN,AVENIDA,"ALBERDI, JUAN BAUTISTA AV.","ALBERDI, JUAN BAUTISTA AV. y PUAN",6,-58.44788671,-34.62539009,PEATON-MOTO,PEATON,MOTO,2016-0083,PEATON,FEMENINO,76,2016-06-29,2016,Tuesday,PEATON,0
2016-0084,1,2016-06-29,2016,6,29,22:00:00,22,CARLOS PELLEGRINI Y TUCUMAN,CALLE,"PELLEGRINI, CARLOS","PELLEGRINI, CARLOS y TUCUMAN",1,-58.38110563,-34.60135531,PEATON-PASAJEROS,PEATON,PASAJEROS,2016-0084,PEATON,MASCULINO,57,2016-07-08,2016,Wednesday,PEATON,0
2016-0085,1,2016-06-29,2016,6,29,22:00:00,22,AVDA ITE FRANCISCO RABANAL & AVDA EREZCANO,AVENIDA,"RABANAL, FRANCISCO, INTENDENTE AV.","RABANAL, FRANCISCO, INTENDENTE AV. y EREZCANO",4,-58.42378834,-34.657341,MOTO-MOVIL,MOTO,OTRO,2016-0085,SD,MASCULINO,42,2016-06-29,2016,Wednesday,MOTO,1
2016-0086,1,2016-06-30,2016,6,30,16:10:00,16,AV OLIVERA Y RAMON FALCON,AVENIDA,OLIVERA AV.,"OLIVERA AV. y FALCON, RAMON L.,CNEL.",10,-58.48727942,-34.63652467,PEATON-PASAJEROS,PEATON,PASAJEROS,2016-0086,PEATON,MASCULINO,75,2016-07-01,2016,Thursday,PEATON,0
2016-0087,1,2016-07-02,2016,7,3,00:10:00,0,AUTOPISTA 1 SUR PTE ARTURO FRONDIZI Y AV CASEROS,AUTOPISTA,AUTOPISTA 1 SUR PRESIDENTE ARTURO FRONDIZI,AUTOPISTA 1 SUR PRESIDENTE ARTURO FRONDIZI y CASEROS AV.,1,-58.37864583,-34.62907067,MOTO-OBJETO FIJO,MOTO,OBJETO FIJO,2016-0087,CONDUCTOR,MASCULINO,23,2016-07-03,2016,Saturday,MOTO,0
2016-0088,1,2016-07-11,2016,7,11,15:30:00,15,CERETTI Y NUÑEZ,CALLE,CERETTI,CERETTI y NUÃ‘EZ,12,-58.5015175,-34.56767549,PEATON-AUTO,PEATON,AUTO,2016-0088,PEATON,FEMENINO,70,2016-07-14,2016,Monday,PEATON,0
2016-0089,1,2016-07-14,2016,7,14,06:40:00,6,AV LUGONES Y LA PAMPA,AUTOPISTA,"LUGONES, LEOPOLDO AV.","LUGONES, LEOPOLDO AV. y LA PAMPA",13,-58.43233425,-34.55185825,PEATON-AUTO,PEATON,AUTO,2016-0089,PEATON,MASCULINO,35,2016-07-14,2016,Thursday,PEATON,1
2016-0090,1,2016-07-14,2016,7,14,22:00:00,22,JERONIMO SALGUERO Y AV RIVADAVIA,AVENIDA,"SALGUERO, JERONIMO","SALGUERO, JERONIMO y RIVADAVIA AV.",5,-58.41971993,-34.6111224,PEATON-PASAJEROS,PEATON,PASAJEROS,2016-0090,PEATON,MASCULINO,60,2016-07-15,2016,Thursday,PEATON,0
2016-0092,1,2016-07-15,2016,7,15,11:00:00,11,AV GRAL PAZ Y AV LIBERTADOR ,GRAL PAZ,"PAZ, GRAL. AV.","PAZ, GRAL. AV. y DEL LIBERTADOR AV.",13,-58.46743471,-34.53476874,MOTO-CARGAS,MOTO,CARGAS,2016-0092,CONDUCTOR,MASCULINO,24,2016-07-15,2016,Friday,MOTO,1
2016-0093,1,2016-07-17,2016,7,17,03:30:00,3,AV JUAN B ALBERDI Y EMILIO MITRE,AVENIDA,"ALBERDI, JUAN BAUTISTA AV.","ALBERDI, JUAN BAUTISTA AV. y MITRE, EMILIO",6,-58.44362126,-34.62301748,AUTO-AUTO,AUTO,AUTO,2016-0093,CONDUCTOR,MASCULINO,35,2016-07-19,2016,Sunday,AUTO,0
2016-0095,1,2016-07-23,2016,7,23,06:12:00,6,MERCEDES Y AV GRAL MOSCONI,AVENIDA,MERCEDES,MERCEDES y MOSCONI GENERAL AV.,11,-58.51713095,-34.59546519,MOTO-AUTO,MOTO,AUTO,2016-0095,CONDUCTOR,MASCULINO,29,2016-07-23,2016,Saturday,MOTO,1
2016-0096,1,2016-07-25,2016,7,25,07:00:00,7,"AUTOPISTA DELLEPIANE LUIS TTE. GRAL. KM. 2,3",AUTOPISTA,AUTOPISTA DELLEPIANE LUIS TTE. GRAL.,AUTOPISTA DELLEPIANE LUIS TTE. GRAL.,8,-58.47433193007387,-34.66684950051973,MOTO-CARGAS,MOTO,CARGAS,2016-0096,CONDUCTOR,MASCULINO,42,2016-07-25,2016,Monday,MOTO,1
2016-0097,1,2016-07-26,2016,7,26,18:45:00,18,SOLIS Y MEXICO,CALLE,SOLIS,SOLIS y MEXICO,1,-58.39038605,-34.6156281,PEATON-AUTO,PEATON,AUTO,2016-0097,PEATON,MASCULINO,80,2016-08-12,2016,Tuesday,PEATON,0
2016-0098,1,2016-07-27,2016,7,27,16:08:00,16,AV SAN JUAN Y ALBERTI,AVENIDA,SAN JUAN AV.,SAN JUAN AV. y ALBERTI,3,-58.40042405,-34.62356174,MOTO-CARGAS,MOTO,CARGAS,2016-0098,CONDUCTOR,FEMENINO,43,2016-07-27,2016,Wednesday,MOTO,1
2016-0099,1,2016-07-29,2016,7,29,16:00:00,16,AV GRAL MOSCONI Y AV GRAL PAZ,GRAL PAZ,MOSCONI GENERAL AV.,"MOSCONI GENERAL AV. y PAZ, GRAL. AV.",11,-58.52340614,-34.59798754,CARGAS-CARGAS,CARGAS,CARGAS,2016-0099,CONDUCTOR,MASCULINO,45,2016-07-29,2016,Friday,CARGAS,1
2016-0100,1,2016-08-03,2016,8,3,23:27:00,23,AV GRAL PAZ  Y DONADO,GRAL PAZ,"PAZ, GRAL. AV.","PAZ, GRAL. AV. y DONADO",12,-58.49491054,-34.54795581,MOTO-OBJETO FIJO,MOTO,OBJETO FIJO,2016-0100,CONDUCTOR,MASCULINO,57,2016-08-03,2016,Wednesday,MOTO,1
2016-0101,1,2016-08-07,2016,8,7,19:42:00,19,AV GRAL PAZ Y JORGE CHAVEZ,GRAL PAZ,"PAZ, GRAL. AV.","PAZ, GRAL. AV. y CHAVEZ, JORGE",9,-58.52932872,-34.65014993,SD-SD,PEATON,AUTO,2016-0101,SD,MASCULINO,67,2016-08-07,2016,Sunday,SD,1
2016-0102,1,2016-08-10,2016,8,10,23:37:00,23,AV EVA PERON Y JOSE LEON SUAREZ,AVENIDA,"PERON, EVA AV.","PERON, EVA AV. y SUAREZ, JOSE LEON",9,-58.50011639,-34.67316502,MOTO-CARGAS,MOTO,CARGAS,2016-0102,CONDUCTOR,MASCULINO,29,2016-08-10,2016,Wednesday,MOTO,1
2016-0104,1,2016-08-14,2016,8,14,21:15:00,21,ZINNY Y AV SANTIAGO DE COMPOSTELA,AVENIDA,ZINNY,ZINNY y SANTIAGO DE COMPOSTELA AV.,9,-58.46635001,-34.65624369,MOTO-PASAJEROS,MOTO,PASAJEROS,2016-0104,CONDUCTOR,MASCULINO,21,2016-08-15,2016,Sunday,MOTO,0
2016-0105,1,2016-08-17,2016,8,17,00:05:00,0,AV FEDERICO LACROZE Y FRAGA,AVENIDA,"LACROZE, FEDERICO AV.","LACROZE, FEDERICO AV. y FRAGA",15,-58.45343236,-34.58435809,PEATON-PASAJEROS,PEATON,PASAJEROS,2016-0105,PEATON,MASCULINO,19,2016-08-26,2016,Wednesday,PEATON,0
2016-0106,1,2016-08-19,2016,8,19,21:02:00,21,CARLOS PELLEGRINI Y AV DEL LIBERTADOR,AVENIDA,"PELLEGRINI, CARLOS","PELLEGRINI, CARLOS y DEL LIBERTADOR AV.",1,-58.38090932,-34.58927731,PEATON-PASAJEROS,PEATON,PASAJEROS,2016-0106,PEATON,MASCULINO,38,2016-08-19,2016,Friday,PEATON,1
2016-0107,1,2016-08-20,2016,8,20,08:22:00,8,AUTOPISTA 9 DE JULIO SUR ALT AV MENDOZA,AUTOPISTA,AUTOPISTA 1 SUR PRESIDENTE ARTURO FRONDIZI,AUTOPISTA 1 SUR PRESIDENTE ARTURO FRONDIZI y DON PEDRO DE MENDOZA AV.,4,-58.37157668,-34.65429986,MOTO-AUTO,MOTO,AUTO,2016-0107,CONDUCTOR,MASCULINO,21,2016-08-20,2016,Saturday,MOTO,1
2016-0109,1,2016-08-24,2016,8,24,05:45:00,5,AUTOPISTA PERITO MORENO Y BARRAGAN,AUTOPISTA,AUTOPISTA PERITO MORENO,AUTOPISTA PERITO MORENO y BARRAGAN,9,-58.52280139,-34.63659934,AUTO-OBJETO FIJO,AUTO,OBJETO FIJO,2016-0109,CONDUCTOR,FEMENINO,53,2016-08-24,2016,Wednesday,AUTO,1
2016-0110,1,2016-08-24,2016,8,24,20:21:00,20,AV ALBERDI Y CARHUE,AVENIDA,"ALBERDI, JUAN BAUTISTA AV.","ALBERDI, JUAN BAUTISTA AV. y CARHUE",9,-58.51232237,-34.6590353,PEATON-SD,PEATON,PASAJEROS,2016-0110,PEATON,MASCULINO,57,2016-08-24,2016,Wednesday,PEATON,1
2016-0111,1,2016-08-25,2016,8,25,09:30:00,9,AUTOPISTA LEOPOLDO LUGONES Y LA PAMPA,AUTOPISTA,LUGONES,LUGONES y LA PAMPA,15,-58.47461905,-34.57663634,MOTO-CARGAS,MOTO,CARGAS,2016-0111,CONDUCTOR,MASCULINO,27,2016-08-25,2016,Thursday,MOTO,1
2016-0112,1,2016-08-27,2016,8,27,04:40:00,4,AUTOPISTA 25 DE MAYO AUTOPISTA 1 SUR ARTURO FRONDIZI,AUTOPISTA,AUTOPISTA 25 DE MAYO,AUTOPISTA 25 DE MAYO y AUTOPISTA 1 SUR PRESIDENTE ARTURO FRONDIZI,1,-58.38268809,-34.62282019,MOTO-OBJETO FIJO,MOTO,OBJETO FIJO,2016-0112,CONDUCTOR,MASCULINO,24,2016-08-27,2016,Saturday,MOTO,1
2016-0113,1,2016-08-27,2016,8,27,16:45:00,16,AV JUAN BAUTISTA ALBERDI Y GUARDIA NACIONAL,AVENIDA,"ALBERDI, JUAN BAUTISTA AV.","ALBERDI, JUAN BAUTISTA AV. y GUARDIA NACIONAL",9,-58.49603546,-34.64564271,PEATON-PASAJEROS,PEATON,PASAJEROS,2016-0113,PEATON,FEMENINO,60,2016-08-27,2016,Saturday,PEATON,1
2016-0114,1,2016-08-31,2016,8,31,11:20:00,11,SALGUERO 1410,CALLE,"SALGUERO, JERONIMO","SALGUERO, JERONIMO 1410",14,-58.41848605,-34.59394733,BICICLETA-CARGAS,BICICLETA,CARGAS,2016-0114,CICLISTA,FEMENINO,55,2016-08-31,2016,Wednesday,BICICLETA,1
2016-0115,1,2016-09-02,2016,9,2,11:50:00,11,ARIAS Y TRONADOR,CALLE,ARIAS,ARIAS y TRONADOR,12,-58.48935041,-34.54917673,SD-CARGAS,PEATON,CARGAS,2016-0115,SD,MASCULINO,42,2016-09-02,2016,Friday,SD,1
2016-0116,1,2016-09-02,2016,9,2,20:20:00,20,AV 27 DE FEBRERO Y AV ESCALADA,AVENIDA,27 DE FEBRERO AV.,27 DE FEBRERO AV. y ESCALADA AV.,8,-58.44451316,-34.68475866,MOTO-AUTO,MOTO,AUTO,2016-0116,CONDUCTOR,MASCULINO,30,2016-09-02,2016,Friday,MOTO,1
2016-0117,1,2016-09-03,2016,9,3,15:30:00,15,AV DEL LIBERTADOR Y TAGLE,AVENIDA,DEL LIBERTADOR AV.,DEL LIBERTADOR AV. y TAGLE,14,-58.39936478,-34.58271474,AUTO-AUTO,AUTO,AUTO,2016-0117,CONDUCTOR,MASCULINO,43,2016-09-03,2016,Saturday,AUTO,1
2016-0118,1,2016-09-04,2016,9,4,03:30:00,3,AUTOPISTA 1 SUR PTE ARTURO FRONDIZI KM 2.9,AUTOPISTA,AUTOPISTA 1 SUR PRESIDENTE ARTURO FRONDIZI,AUTOPISTA 1 SUR PRESIDENTE ARTURO FRONDIZI KM. 2.9,1,-58.37936704,-34.62694503,AUTO-AUTO,AUTO,AUTO,2016-0118,CONDUCTOR,MASCULINO,27,2016-09-04,2016,Sunday,AUTO,1
2016-0119,1,2016-09-04,2016,9,4,06:40:00,6,CRISOLOGO LARRALDE Y AVDA TRIUNVIRATO,AVENIDA,"LARRALDE, CRISOLOGO AV.","LARRALDE, CRISOLOGO AV. y TRIUNVIRATO AV.",12,-58.49659234,-34.56353635,SD-SD,PEATON,PASAJEROS,2016-0119,PASAJERO_ACOMPAÑANTE,FEMENINO,42,2016-09-04,2016,Sunday,SD,1
2016-0122,1,2016-09-13,2016,9,13,07:10:00,7,AV EVA PERON 4233,AVENIDA,"PERON, EVA AV.","PERON, EVA AV. 4233",9,-58.47256391,-34.65194557,BICICLETA-PASAJEROS,BICICLETA,PASAJEROS,2016-0122,CICLISTA,MASCULINO,49,2016-09-13,2016,Tuesday,BICICLETA,1
2016-0123,1,2016-09-14,2016,9,14,09:00:00,9,AV ASAMBLEA Y AV CNEL ESTEBAN BONORINO,AVENIDA,ASAMBLEA AV.,"ASAMBLEA AV. y BONORINO, ESTEBAN, CNEL. AV.",7,-58.45130953,-34.64053676,MOTO-AUTO,MOTO,AUTO,2016-0123,CONDUCTOR,FEMENINO,58,2016-09-14,2016,Wednesday,MOTO,1
2016-0124,1,2016-09-16,2016,9,16,15:24:00,15,AVDA RIVADAVIA Y RIVERA INDARTE,AVENIDA,RIVADAVIA AV.,RIVADAVIA AV. y RIVERA INDARTE AV.,7,-58.46271207,-34.62884871,PEATON-PASAJEROS,PEATON,PASAJEROS,2016-0124,PEATON,MASCULINO,67,2016-09-16,2016,Friday,PEATON,1
2016-0125,1,2016-09-17,2016,9,17,12:14:00,12,AUTOPISTA PERITO MORENO Y AV JUAN B ALBERDI,AUTOPISTA,AUTOPISTA PERITO MORENO,"AUTOPISTA PERITO MORENO y ALBERDI, JUAN BAUTISTA AV.",10,-58.49020869,-34.64243791,MOTO-MOTO,MOTO,MOTO,2016-0125,CONDUCTOR,MASCULINO,30,2016-09-17,2016,Saturday,MOTO,1
2016-0126,2,2016-09-18,2016,9,18,22:45:00,22,IRIGOYEN Y TINOGASTA,CALLE,IRIGOYEN,IRIGOYEN y TINOGASTA,10,-58.52572109,-34.62125906,AUTO-CARGAS,AUTO,CARGAS,2016-0126,CONDUCTOR,MASCULINO,37,2016-09-18,2016,Sunday,AUTO,1
2016-0126,2,2016-09-18,2016,9,18,22:45:00,22,IRIGOYEN Y TINOGASTA,CALLE,IRIGOYEN,IRIGOYEN y TINOGASTA,10,-58.52572109,-34.62125906,AUTO-CARGAS,AUTO,CARGAS,2016-0126,PASAJERO_ACOMPAÑANTE,MASCULINO,60,2016-09-18,2016,Sunday,AUTO,1
